{
  "ledger_version": "1.0.0",
  "research_as_of": "2026-10-24",
  "window": {
    "start": "2018-01",
    "end": "2025-12"
  },
  "selection_protocol": "Focused milestones selected before any KBA/Trends relationship inspection: initial Model 3/Y German entries, Berlin handovers, Highland/Juniper offers, January 2023 prices, one financing/supply example and distinct physical/OTA recalls. No outcome-conditioned event selection. Not exhaustive; source articles may contain incidental market figures, not extracted as outcomes.",
  "taxonomy": [
    {
      "offering_id": "model3-rwd",
      "model": "model_3",
      "trim_scope": "Rear-wheel-drive base",
      "aliases": [
        "RWD / Standard Range Plus aliases require version review"
      ]
    },
    {
      "offering_id": "model3-lr-awd",
      "model": "model_3",
      "trim_scope": "Long Range AWD",
      "aliases": [
        "Maximale Reichweite"
      ]
    },
    {
      "offering_id": "model3-performance",
      "model": "model_3",
      "trim_scope": "Performance",
      "aliases": [
        "Performance"
      ]
    },
    {
      "offering_id": "modely-rwd",
      "model": "model_y",
      "trim_scope": "Rear-wheel-drive base",
      "aliases": [
        "RWD"
      ]
    },
    {
      "offering_id": "modely-lr-awd",
      "model": "model_y",
      "trim_scope": "Long Range AWD",
      "aliases": [
        "Long Range"
      ]
    },
    {
      "offering_id": "modely-performance",
      "model": "model_y",
      "trim_scope": "Performance",
      "aliases": [
        "Performance"
      ]
    },
    {
      "offering_id": "modely-launch-lr-awd-2025",
      "model": "model_y",
      "trim_scope": "2025 Launch Series LR AWD",
      "aliases": [
        "Juniper Launch Series"
      ]
    },
    {
      "offering_id": "models-unspecified",
      "model": "model_s",
      "trim_scope": "Legacy trim unspecified",
      "aliases": [
        "Not a complete legacy trim census"
      ]
    },
    {
      "offering_id": "modelx-unspecified",
      "model": "model_x",
      "trim_scope": "Legacy trim unspecified",
      "aliases": [
        "Not a complete legacy trim census"
      ]
    }
  ],
  "sources": [
    {
      "source_id": "archive-config-body",
      "url": "https://web.archive.org/web/20230901090712id_/https://www.tesla.com/de_DE/model3/design",
      "publisher": "Tesla",
      "source_type": "primary",
      "accessed_on": "2026-10-24",
      "publication_date": {
        "value": null,
        "precision": "unknown",
        "role": "unknown"
      },
      "response_sha256": "ea4a7d2582d44907042bfbbec285c10d6faa120e8aea3bfcd6f7a2b5f2a52b6e",
      "content_status": "archived_content_read",
      "quote_snippet": "\"effective_date\":\"2023-09-01T00:50:00.000Z\",\"market\":\"DE\",\"product\":\"m3\"",
      "reuse": "Third-party rights not inferred as open; own factual summaries and short attributed excerpts only. No raw text/images/HTML redistributed."
    },
    {
      "source_id": "model3-first",
      "url": "https://teslamag.de/news/tesla-liefert-die-ersten-model-3-in-deutschland-aus-bilder-23374",
      "publisher": "Teslamag",
      "source_type": "secondary",
      "accessed_on": "2026-10-24",
      "publication_date": {
        "value": "2019-02-15",
        "precision": "day",
        "role": "published"
      },
      "response_sha256": "3cc8c51eea47c47de2404771643e61f058624d06264712db918b599bb3044313",
      "content_status": "article_read",
      "quote_snippet": "Nun übergab Tesla auch in Deutschland die ersten Model 3 an Käufer",
      "reuse": "Third-party rights not inferred as open; own factual summaries and short attributed excerpts only. No raw text/images/HTML redistributed."
    },
    {
      "source_id": "modely-official-de",
      "url": "https://teslamag.de/news/massenmodell-kein-kleinwagen-tesla-model-y-start-offiziell-deutschland-40279",
      "publisher": "Teslamag",
      "source_type": "secondary",
      "accessed_on": "2026-10-24",
      "publication_date": {
        "value": "2021-08-20",
        "precision": "day",
        "role": "published"
      },
      "response_sha256": "b8a19d6d5596a106cc5c41699846aa07c66d76f654ae7e926800b40a2b9a9c8a",
      "content_status": "article_read",
      "quote_snippet": "das am Donnerstag an mehreren Tesla-Standorten offiziell in den deutschen Markt eingeführt wurde",
      "reuse": "Third-party rights not inferred as open; own factual summaries and short attributed excerpts only. No raw text/images/HTML redistributed."
    },
    {
      "source_id": "modely-first",
      "url": "https://teslamag.de/news/deutschland-start-tesla-model-y-mehrere-staedten-fruehe-besteller-uebergeben-40371",
      "publisher": "Teslamag",
      "source_type": "secondary",
      "accessed_on": "2026-10-24",
      "publication_date": {
        "value": "2021-08-23",
        "precision": "day",
        "role": "published"
      },
      "response_sha256": "dba799d3af46c3d26584b3c13d3cc7106816407a5b82680100843fb65b98df12",
      "content_status": "article_read",
      "quote_snippet": "Eine der ersten überhaupt soll schon am Freitag in Kiel stattgefunden haben",
      "reuse": "Third-party rights not inferred as open; own factual summaries and short attributed excerpts only. No raw text/images/HTML redistributed."
    },
    {
      "source_id": "berlin-delivery",
      "url": "https://teslamag.de/news/delivery-day-tesla-ceo-musk-erste-model-y-deutsche-gigafactory-46884",
      "publisher": "Teslamag",
      "source_type": "secondary",
      "accessed_on": "2026-10-24",
      "publication_date": {
        "value": "2022-03-22",
        "precision": "day",
        "role": "published"
      },
      "response_sha256": "e0a15bec3da68ccef6fad427b2b644ad63ec73120a2ed1b7950b9fbb0489b0cd",
      "content_status": "article_read",
      "quote_snippet": "Tesla am Dienstag mit den Auslieferungen aus seiner deutschen Gigafactory begonnen",
      "reuse": "Third-party rights not inferred as open; own factual summaries and short attributed excerpts only. No raw text/images/HTML redistributed."
    },
    {
      "source_id": "berlin-corroboration",
      "url": "https://teslamag.de/news/deutschland-erste-reine-elektroauto-fabrik-tesla-delivery-day-46893",
      "publisher": "Teslamag",
      "source_type": "secondary",
      "accessed_on": "2026-10-24",
      "publication_date": {
        "value": "2022-03-23",
        "precision": "day",
        "role": "published"
      },
      "response_sha256": "688b0520e7b5b7899f2e20d0b532b39b45a0716772d049020b2f61c50b8b8105",
      "content_status": "article_read",
      "quote_snippet": "Vor Ort aber herrschte beste Stimmung, als 30 Besteller am „Delivery Day“ von CEO Elon Musk ihre Model Y Performance übergeben bekamen.",
      "reuse": "Third-party rights not inferred as open; own factual summaries and short attributed excerpts only. No raw text/images/HTML redistributed."
    },
    {
      "source_id": "highland-open",
      "url": "https://teslamag.de/news/neues-tesla-model-3-basis-version-1000-euro-mehr-678-km-reichweite-60773",
      "publisher": "Teslamag",
      "source_type": "secondary",
      "accessed_on": "2026-10-24",
      "publication_date": {
        "value": "2023-09-01",
        "precision": "day",
        "role": "published"
      },
      "response_sha256": "deeaad3660aa9fbf6635e49baf43d15b783e6af995efd0cea74a080c343184c9",
      "content_status": "article_read",
      "quote_snippet": "ist das Model 3 ab jetzt in einer aufgefrischten Version bestellbar",
      "reuse": "Third-party rights not inferred as open; own factual summaries and short attributed excerpts only. No raw text/images/HTML redistributed."
    },
    {
      "source_id": "juniper-de",
      "url": "https://teslamag.de/news/tesla-europa-verkauf-neues-model-y-launch-edition-hoher-preis-64681",
      "publisher": "Teslamag",
      "source_type": "secondary",
      "accessed_on": "2026-10-24",
      "publication_date": {
        "value": "2025-01-24",
        "precision": "day",
        "role": "published"
      },
      "response_sha256": "0482dcbc8aa318e6c57aa1aa2b70476c9c4eba986ec5b58c35744b159c99b945",
      "content_status": "article_read",
      "quote_snippet": "Am Freitagmorgen teilte das Unternehmen mit, dass dieses Elektroauto ab sofort zu bestellen ist",
      "reuse": "Third-party rights not inferred as open; own factual summaries and short attributed excerpts only. No raw text/images/HTML redistributed."
    },
    {
      "source_id": "juniper-delivery",
      "url": "https://teslamag.de/news/10-25-tesla-model-y-kunden-trump-effekt-dritte-megafactory-akku-analyse-64859",
      "publisher": "Teslamag",
      "source_type": "secondary",
      "accessed_on": "2026-10-24",
      "publication_date": {
        "value": "2025-03-09",
        "precision": "day",
        "role": "published"
      },
      "response_sha256": "3ea5a63f22662d24722628f8ff2db48b5ccdc398a83259cf55792d8aee43364f",
      "content_status": "article_read",
      "quote_snippet": "Tesla am Freitag die ersten aufgefrischten Model Y ausgeliefert",
      "reuse": "Third-party rights not inferred as open; own factual summaries and short attributed excerpts only. No raw text/images/HTML redistributed."
    },
    {
      "source_id": "price-cut-de",
      "url": "https://teslamag.de/news/tesla-preise-model-y-9100-euro-billiger-model-3-6000-euro-55941",
      "publisher": "Teslamag",
      "source_type": "secondary",
      "accessed_on": "2026-10-24",
      "publication_date": {
        "value": "2023-01-13",
        "precision": "day",
        "role": "published"
      },
      "response_sha256": "cf76171ec1eaf743ce4a794bc6fcdf636d73f4ead47b5d4a07a72e0a316dc701",
      "content_status": "article_read",
      "quote_snippet": "In Deutschland beginnt der Einstieg in die Tesla-Welt seit Freitag laut Konfigurator bei 43.990 Euro",